{"artifact_names":{"docx":"Number_7_Dream_RU.docx","html":"Number_7_Dream_RU.html","master_en":"MASTER_EN.md","master_ru":"MASTER_RU.md","pdf":"Number_7_Dream_RU.pdf"},"artview":{"decision_schema":"kb_creator.scenario_artview_decisions.v4","decision_version":4,"profile":{"bytes":1321,"path":"kb_creator/inputs/number-7-dream/publication/v2/configs/artview/profile.json","sha256":"3434B9FA90C430A0D3A672394E8286DF630DB21D930509C72591F59AE8B90C5B"},"required_bundle_roles":["candidate_manifest","review_html","accepted_decisions","application_receipt","effective_visual_config","bundle_inventory","candidate_binaries","source_context"]},"configs":[{"file":{"bytes":557,"path":"kb_creator/inputs/number-7-dream/publication/v2/configs/master_en.json","sha256":"F20821920216F6C0DA3A8893D4E11DA0C603D330DF2968E28D6614CC63A574A1"},"role":"master_en"},{"file":{"bytes":78,"path":"kb_creator/inputs/number-7-dream/publication/v2/configs/master_ru.json","sha256":"C72AB02C24A7B079AE1C0B858D6015F6F3CC324A8391971289708BC90FD03FA6"},"role":"master_ru"},{"file":{"bytes":1321,"path":"kb_creator/inputs/number-7-dream/publication/v2/configs/artview/profile.json","sha256":"3434B9FA90C430A0D3A672394E8286DF630DB21D930509C72591F59AE8B90C5B"},"role":"artview"},{"file":{"bytes":4152,"path":"kb_creator/inputs/number-7-dream/publication/v2/configs/html.json","sha256":"11FA2082837D3A5E177E0D4736430B6AD9BD8F779C0D63D6B500A50BB3E04721"},"role":"html"},{"file":{"bytes":1550,"path":"kb_creator/inputs/number-7-dream/publication/v2/configs/docx.json","sha256":"2AF5C668263A2CF4333E734151C6D21E2459E4800506CABE9880A6DCBEDF29B2"},"role":"docx"},{"file":{"bytes":45,"path":"kb_creator/inputs/number-7-dream/publication/v2/configs/pdf.json","sha256":"8C9875AAD9AA0CAF46642E056129477D7235A0F434B73438D612D142238F309A"},"role":"pdf"},{"file":{"bytes":49,"path":"kb_creator/inputs/number-7-dream/publication/v2/configs/package.json","sha256":"5643406F004E4996A3AC42640DB5FE72EE16CA9DF566B3202639CA50C050EA7A"},"role":"package"}],"contract_revision":1,"docx":{"adapter":"production_docx_explicit_config_v1","config":{"bytes":1550,"path":"kb_creator/inputs/number-7-dream/publication/v2/configs/docx.json","sha256":"2AF5C668263A2CF4333E734151C6D21E2459E4800506CABE9880A6DCBEDF29B2"},"required_qa":["accepted_html_identity","ooxml_integrity","all_page_png","reader_layout","document_metadata"]},"html":{"adapter":"translator_build_production_html_v1","config":{"bytes":4152,"path":"kb_creator/inputs/number-7-dream/publication/v2/configs/html.json","sha256":"11FA2082837D3A5E177E0D4736430B6AD9BD8F779C0D63D6B500A50BB3E04721"},"required_qa":["accepted_master_ru_identity","accepted_artview_identity","local_reference_closure","structural_html","all_page_visual_review"]},"master_en":{"config":{"bytes":557,"path":"kb_creator/inputs/number-7-dream/publication/v2/configs/master_en.json","sha256":"F20821920216F6C0DA3A8893D4E11DA0C603D330DF2968E28D6614CC63A574A1"},"profile":"neutral_v3","required_qa":["accepted_upstream_identity","exact_source_projection","source_disposition_closure","asset_manifest_closure","candidate_inventory_closure","independent_v3_verification"]},"master_ru":{"config":{"bytes":78,"path":"kb_creator/inputs/number-7-dream/publication/v2/configs/master_ru.json","sha256":"C72AB02C24A7B079AE1C0B858D6015F6F3CC324A8391971289708BC90FD03FA6"},"packet_policy":"ordered_hash_bound_units_v1","profile":"neutral_v1","required_qa":["accepted_master_en_identity","ordered_unit_identity","markdown_structure_preservation","mechanics_preservation","terminology_authority","asset_identity","independent_translation_qa"],"terminology":[{"bytes":16003,"path":"CoC/Project_Reference/Terminology/CoC_Terminology_Decisions.csv","sha256":"EE84E121E63ECDA3F2165205E8335FD3C68E70CF1DEFE1D00CE6C3FF97EFF3AE"}]},"package":{"required_roles":["master_en","master_en_acceptance","master_ru","master_ru_acceptance","artview_bundle","artview_candidate_manifest","artview_decisions","artview_application","artview_effective_config","artview_acceptance","html","html_acceptance","docx","docx_acceptance","pdf","pdf_acceptance","source_configs","effective_config","stage_evidence","pipeline_snapshot","schema_snapshot","offline_verifier"],"stable_names":true,"verifier_version":1},"pdf":{"adapter":"docx_pdf_export_v1","export_policy":{"all_pages":true,"document_input_role":"accepted_docx","format":"pdf","fresh_export":true},"required_qa":["accepted_docx_identity","fresh_docx_export","all_page_png","no_direct_html_route"]},"scenario":{"id":"number-7-dream","language_source":"en","language_target":"ru","title_en":"Number 7 Dream","title_ru":"Сон № 7"},"schema":"kb_creator.scenario_publication_contract.v1","tool_policy":{"allowed_system_tools":["powershell","microsoft_word_com"],"repository_tool_root":".tools"},"upstream":{"reconstruction_contract_sha256":"A74582B223805E643EB6B7C03BD540DBB90CF2B0B124F9B1E220B6B7251B4A07","required_artifact_roles":["reconstructed_en","reconstruction_manifest","reconstruction_qa","source_identity"]}}
