{"artifact_names":{"docx":"Dissociation_RU.docx","html":"Dissociation_RU.html","master_en":"MASTER_EN.md","master_ru":"MASTER_RU.md","pdf":"Dissociation_RU.pdf"},"artview":{"decision_schema":"kb_creator.scenario_artview_decisions.v3","decision_version":3,"profile":{"bytes":3018,"path":"kb_creator/inputs/dissociation/publication/v1/configs/artview/profile.json","sha256":"D847123065C99DB39A41CD26949F0B74342E603AB2A604A5390CFEAB0376F18A"},"required_bundle_roles":["candidate_manifest","review_html","accepted_decisions","application_receipt","effective_visual_config","bundle_inventory","candidate_binaries","source_context"]},"configs":[{"file":{"bytes":554,"path":"kb_creator/inputs/dissociation/publication/v1/configs/master_en.json","sha256":"B9F02C6440BB142ED281D9518049F798DE492AA8524AD7E1530BCC768BEDB52C"},"role":"master_en"},{"file":{"bytes":77,"path":"kb_creator/inputs/dissociation/publication/v1/configs/master_ru.json","sha256":"A5C0BAFA954E957F47B0E880FAC1FB70DA857CD3364882CC5FFEFB194F900E7B"},"role":"master_ru"},{"file":{"bytes":3018,"path":"kb_creator/inputs/dissociation/publication/v1/configs/artview/profile.json","sha256":"D847123065C99DB39A41CD26949F0B74342E603AB2A604A5390CFEAB0376F18A"},"role":"artview"},{"file":{"bytes":1827,"path":"kb_creator/inputs/dissociation/publication/v1/configs/html.json","sha256":"7C27A41974AB01EEAE274DCD9BB6257547E929A017C7103F60D7D428FBCB7BDC"},"role":"html"},{"file":{"bytes":1573,"path":"kb_creator/inputs/dissociation/publication/v1/configs/docx.json","sha256":"9327D4A3F81610E7A889995DA559DF0644EA0AE4BF993F5862DF942119EE41C5"},"role":"docx"},{"file":{"bytes":44,"path":"kb_creator/inputs/dissociation/publication/v1/configs/pdf.json","sha256":"EF783EAA329FDD591FFE8E24CC553B671B7B12C8499B5248D92B03EA1FE720E0"},"role":"pdf"},{"file":{"bytes":48,"path":"kb_creator/inputs/dissociation/publication/v1/configs/package.json","sha256":"57D85F492D42CF58BF3547662327007842A441D43009B45ADC7F4CF533C991B9"},"role":"package"}],"contract_revision":1,"docx":{"adapter":"production_docx_explicit_config_v1","config":{"bytes":1573,"path":"kb_creator/inputs/dissociation/publication/v1/configs/docx.json","sha256":"9327D4A3F81610E7A889995DA559DF0644EA0AE4BF993F5862DF942119EE41C5"},"required_qa":["accepted_html_identity","ooxml_integrity","all_page_png","reader_layout","document_metadata"]},"html":{"adapter":"translator_build_production_html_v1","config":{"bytes":1827,"path":"kb_creator/inputs/dissociation/publication/v1/configs/html.json","sha256":"7C27A41974AB01EEAE274DCD9BB6257547E929A017C7103F60D7D428FBCB7BDC"},"required_qa":["accepted_master_ru_identity","accepted_artview_identity","local_reference_closure","structural_html","all_page_visual_review"]},"master_en":{"config":{"bytes":554,"path":"kb_creator/inputs/dissociation/publication/v1/configs/master_en.json","sha256":"B9F02C6440BB142ED281D9518049F798DE492AA8524AD7E1530BCC768BEDB52C"},"profile":"neutral_v3","required_qa":["accepted_upstream_identity","exact_source_projection","source_disposition_closure","asset_manifest_closure","candidate_inventory_closure","independent_v3_verification"]},"master_ru":{"config":{"bytes":77,"path":"kb_creator/inputs/dissociation/publication/v1/configs/master_ru.json","sha256":"A5C0BAFA954E957F47B0E880FAC1FB70DA857CD3364882CC5FFEFB194F900E7B"},"packet_policy":"ordered_hash_bound_units_v1","profile":"neutral_v1","required_qa":["accepted_master_en_identity","ordered_unit_identity","markdown_structure_preservation","mechanics_preservation","terminology_authority","asset_identity","independent_translation_qa"],"terminology":[{"bytes":16003,"path":"CoC/Project_Reference/Terminology/CoC_Terminology_Decisions.csv","sha256":"EE84E121E63ECDA3F2165205E8335FD3C68E70CF1DEFE1D00CE6C3FF97EFF3AE"}]},"package":{"required_roles":["master_en","master_en_acceptance","master_ru","master_ru_acceptance","artview_bundle","artview_candidate_manifest","artview_decisions","artview_application","artview_effective_config","artview_acceptance","html","html_acceptance","docx","docx_acceptance","pdf","pdf_acceptance","source_configs","effective_config","stage_evidence","pipeline_snapshot","schema_snapshot","offline_verifier"],"stable_names":true,"verifier_version":1},"pdf":{"adapter":"docx_pdf_export_v1","export_policy":{"all_pages":true,"document_input_role":"accepted_docx","format":"pdf","fresh_export":true},"required_qa":["accepted_docx_identity","fresh_docx_export","all_page_png","no_direct_html_route"]},"scenario":{"id":"dissociation","language_source":"en","language_target":"ru","title_en":"Dissociation","title_ru":"Диссоциация"},"schema":"kb_creator.scenario_publication_contract.v1","tool_policy":{"allowed_system_tools":["powershell","microsoft_word_com"],"repository_tool_root":".tools"},"upstream":{"reconstruction_contract_sha256":"99B01F09AA9CFCE72AC407ADBFF21E54BC11A2FDA73A00FDB0FC763024FEAD4E","required_artifact_roles":["reconstructed_en","reconstruction_manifest","reconstruction_qa","source_identity"]}}
